{
  "summary": {
    "verdict": "request_changes",
    "overall_score": 5,
    "one_paragraph": "Retry logic is useful but mixed with HTTP handling in one type, lacks concurrency tests, and the CL description omits idempotency requirements. Address blockers before merge."
  },
  "grades": {
    "alpha": {
      "score": 5,
      "rationale": "Mixed responsibilities increase coupling and make failure modes hard to reason about."
    },
    "beta": {
      "score": 4,
      "rationale": "Race condition possible; tests cover happy path only."
    }
  },
  "overall_score": 5,
  "good_things": [
    "Exponential backoff parameters are centralized in RetryPolicy."
  ],
  "findings": [
    {
      "id": "alpha-001",
      "dimension": "alpha",
      "severity": "high",
      "location": "src/ordering/processor.rs:12-180",
      "observation": "OrderProcessor constructs reqwest::Client, runs retry loops, and calls SqlStore in one type.",
      "why_it_matters": "Mixed responsibilities make failure modes hard to reason about.",
      "recommended_action": "Extract HttpClient and RetryExecutor; keep OrderProcessor as orchestration only.",
      "evidence": "struct OrderProcessor { client: Client, store: SqlStore, policy: RetryPolicy }"
    },
    {
      "id": "beta-001",
      "dimension": "beta",
      "severity": "high",
      "location": "src/ordering/processor.rs:98-112",
      "observation": "Two concurrent process(order_id) calls can both pass the pre-check and double-charge.",
      "why_it_matters": "Parallel retries can introduce duplicate side effects under load.",
      "recommended_action": "Use transactional idempotency key or SELECT FOR UPDATE before side effects."
    },
    {
      "id": "beta-002",
      "dimension": "beta",
      "severity": "high",
      "location": "src/ordering/processor_test.rs",
      "observation": "Only test_process_success exists; no failure or concurrency coverage.",
      "why_it_matters": "Tests must fail when retry or race regressions are introduced.",
      "recommended_action": "Add tests: transient error then success, max attempts exceeded, concurrent duplicate."
    },
    {
      "id": "alpha-002",
      "dimension": "alpha",
      "severity": "high",
      "location": "PR description",
      "observation": "Body describes backoff timings but not idempotency or worker pool constraints.",
      "why_it_matters": "Future readers cannot judge whether duplicate charge risk was accepted.",
      "recommended_action": "Add a Risks/idempotency section listing required keys and DB locking approach."
    },
    {
      "id": "alpha-003",
      "dimension": "alpha",
      "severity": "low",
      "location": "src/ordering/processor.rs:200-240",
      "observation": "Structured logging refactor in the same file as retry logic.",
      "why_it_matters": "Mixed concerns slow review and increase merge conflict risk.",
      "recommended_action": "Move logging refactor to a separate CL or revert it from this change."
    },
    {
      "id": "beta-003",
      "dimension": "beta",
      "severity": "low",
      "location": "README.md",
      "observation": "README still documents immediate-fail behavior for order processing.",
      "why_it_matters": "Operators will misconfigure timeouts when behavior changes.",
      "recommended_action": "Update README with retry bounds and idempotency requirements."
    }
  ],
  "limitations": [
    "Did not execute load test; concurrency finding from static analysis."
  ],
  "suggested_next_steps": [
    "Split logging refactor into its own CL.",
    "Extract HTTP and retry collaborators; shrink OrderProcessor.",
    "Add idempotency or locking and concurrent tests.",
    "Expand PR description and README."
  ]
}
