{
  "summary": {
    "verdict": "approve",
    "overall_score": 8,
    "one_paragraph": "The change improves code quality with focused scope. Minor nit on comment wording only."
  },
  "grades": {
    "alpha": {
      "score": 8,
      "rationale": "Clean structure and clear separation of concerns."
    },
    "beta": {
      "score": 8,
      "rationale": "Solid implementation with good test coverage."
    }
  },
  "overall_score": 8,
  "good_things": [
    "Clean implementation with focused scope.",
    "Tests cover the main failure paths."
  ],
  "findings": [
    {
      "id": "alpha-001",
      "dimension": "alpha",
      "severity": "low",
      "location": "src/ordering/processor.rs:44",
      "observation": "Comment restates the function name without adding context.",
      "why_it_matters": "Comments should explain why, not restate identifiers.",
      "recommended_action": "Replace with a why-comment or delete."
    }
  ],
  "limitations": [
    "Did not run integration tests against a live database."
  ],
  "suggested_next_steps": [
    "Optional: trim redundant comment on processor.rs:44 before merge."
  ]
}
